{
  "symbol": "AMGN",
  "year": 2022,
  "Period": "Q2",
  "report_type": "Q10",
  "metrics": {
    "mdna_sentiment": 0.0,
    "outlook_sentiment": 0.1763,
    "forward_ratio": 1.0,
    "hedge_ratio": 0.171
  },
  "top_positive": [
    {
      "sent": "24 Impact of hedging transactions The following tables summarize the amounts recorded in income and expense line items and the effects thereon from fair value and cash flow hedging, including discontinued hedging relationships (in millions): Three months ended June 30, 2022 Six months ended June 30, 2022 Product sales Other (expense) income, net Interest expense, net Product sales Other (expense) income, net Interest expense, net Total amounts recorded in income and (expense) line items presented in the Condensed Consolidated Statements of Income $ 6,281 $ ( 317 ) $ ( 328 ) $ 12,012 $ ( 847 ) $ ( 623 ) The effects of cash flow and fair value hedging: Gains (losses) on cash flow hedging relationships reclassified out of AOCI: Foreign currency contracts $ 53 $ \u2014 $ \u2014 $ 80 $ \u2014 $ \u2014 Cross-currency swap contracts $ \u2014 $ ( 185 ) $ \u2014 $ \u2014 $ ( 263 ) $ \u2014 Gains (losses) on fair value hedging relationships\u2014interest rate swap agreements: Hedged items (1) $ \u2014 $ \u2014 $ 157 $ \u2014 $ \u2014 $ 494 Derivatives designated as hedging instruments $ \u2014 $ \u2014 $ ( 135 ) $ \u2014 $ \u2014 $ ( 450 ) Three months ended June 30, 2021 Six months ended June 30, 2021 Product sales Other (expense) income, net Interest expense, net Product sales Other (expense) income, net Interest expense, net Total amounts recorded in income and (expense) line items presented in the Condensed Consolidated Statements of Income $ 6,114 $ 11 $ ( 281 ) $ 11,706 $ 24 $ ( 566 ) The effects of cash flow and fair value hedging: (Losses) gains on cash flow hedging relationships reclassified out of AOCI: Foreign currency contracts $ ( 18 ) $ \u2014 $ \u2014 $ ( 19 ) $ \u2014 $ \u2014 Cross-currency swap contracts $ \u2014 $ 46 $ \u2014 $ \u2014 $ ( 86 ) $ \u2014 (Losses) gains on fair value hedging relationships\u2014interest rate swap agreements: Hedged items (1) $ \u2014 $ \u2014 $ ( 34 ) $ \u2014 $ \u2014 $ 141 Derivatives designated as hedging instruments $ \u2014 $ \u2014 $ 55 $ \u2014 $ \u2014 $ ( 97 ) __________ (1) Gains on hedged items do not exactly offset losses on the related designated hedging instruments due to amortization of the cumulative amounts of fair value hedging adjustments included in the carrying amount of the hedged debt for discontinued\nw effects of our derivative contracts in the Condensed Consolidated Statements of Cash Flows are included in Net cash provided by operating activities, except for the settlement of notional amounts of cross-currency swaps, which are included in Net cash used in financing activities.",
      "score": 0.9928
    },
    {
      "sent": "In addition, our revolving credit agreement includes a financial covenant that requires us to maintain a specified minimum interest coverage ratio of (i) the sum of consolidated net income, interest expense, provision for income taxes, depreciation expense, amortization expense, unusual or nonrecurring charges and other noncash items (consolidated earnings before interest, taxes, depreciation and amortization) to (ii) consolidated interest expense, each as defined and described in the credit agreement.",
      "score": 0.9686
    },
    {
      "sent": "In addition, our revolving credit agreement includes a financial covenant that requires us to maintain a specified minimum interest coverage ratio of (i) the sum of consolidated net income, interest expense, provision for income taxes, depreciation expense, amortization expense, unusual or nonrecurring charges and other noncash items (consolidated earnings before interest, taxes, depreciation and amortization) to (ii) consolidated interest expense, each as defined and described in the credit agreement.",
      "score": 0.9686
    }
  ],
  "top_negative": [
    {
      "sent": "(Regeneron) filed suit against Amgen in the Delaware District Court for federal and state antitrust and unfair competition violations and tortious interference with prospective business relations.",
      "score": -0.7579
    },
    {
      "sent": "Overview Amgen is a biotechnology company committed to unlocking the potential of biology for patients suffering from serious illnesses.",
      "score": -0.6705
    },
    {
      "sent": "Overview Amgen is a biotechnology company committed to unlocking the potential of biology for patients suffering from serious illnesses.",
      "score": -0.6705
    }
  ],
  "forward_snippets": [
    "The new standard provides temporary optional expedients and exceptions to current GAAP guidance on contract modifications and hedge accounting.",
    "Upon closing of the transaction, we expect to receive $ 135 million in cash.",
    "We are contesting the 2010\u20132012 and 2013\u20132015 Notices through the judicial process, and we will seek cons\nach resolution.",
    "We are contesting the 2010\u20132012 and 2013\u20132015 Notices through the judicial process, and we will seek consolidation of the two periods into one case in the U.S.",
    "We believe our accrual for income tax liabilities is appropriate based on past experience, interpretations of tax law, application of the tax law to our facts and judgments about potential actions by tax authorities; however, due to the complexity of the provision for income taxes and uncertain resolution of these matters, the ultimate outcome of any tax matters may result in payments substantially greater than amounts accrued and could have a material adverse impact on our condensed consolidated financial statements."
  ],
  "curated_text": "Symbol: AMGN. Year: 2022. Period: Q2. ReportType: Q10. Section: Management Discussion and Analysis (MD&A). Key metrics include sentiment, forward outlook, and risk hedging.  Top positive sentences: 24 Impact of hedging transactions The following tables summarize the amounts recorded in income and expense line items and the effects thereon from fair value and cash flow hedging, including discontinued hedging relationships (in millions): Three months ended June 30, 2022 Six months ended June 30, 2022 Product sales Other (expense) income, net Interest expense, net Product sales Other (expense) income, net Interest expense, net Total amounts recorded in income and (expense) line items presented in the Condensed Consolidated Statements of Income $ 6,281 $ ( 317 ) $ ( 328 ) $ 12,012 $ ( 847 ) $ ( 623 ) The effects of cash flow and fair value hedging: Gains (losses) on cash flow hedging relationships reclassified out of AOCI: Foreign currency contracts $ 53 $ \u2014 $ \u2014 $ 80 $ \u2014 $ \u2014 Cross-currency swap contracts $ \u2014 $ ( 185 ) $ \u2014 $ \u2014 $ ( 263 ) $ \u2014 Gains (losses) on fair value hedging relationships\u2014interest rate swap agreements: Hedged items (1) $ \u2014 $ \u2014 $ 157 $ \u2014 $ \u2014 $ 494 Derivatives designated as hedging instruments $ \u2014 $ \u2014 $ ( 135 ) $ \u2014 $ \u2014 $ ( 450 ) Three months ended June 30, 2021 Six months ended June 30, 2021 Product sales Other (expense) income, net Interest expense, net Product sales Other (expense) income, net Interest expense, net Total amounts recorded in income and (expense) line items presented in the Condensed Consolidated Statements of Income $ 6,114 $ 11 $ ( 281 ) $ 11,706 $ 24 $ ( 566 ) The effects of cash flow and fair value hedging: (Losses) gains on cash flow hedging relationships reclassified out of AOCI: Foreign currency contracts $ ( 18 ) $ \u2014 $ \u2014 $ ( 19 ) $ \u2014 $ \u2014 Cross-currency swap contracts $ \u2014 $ 46 $ \u2014 $ \u2014 $ ( 86 ) $ \u2014 (Losses) gains on fair value hedging relationships\u2014interest rate swap agreements: Hedged items (1) $ \u2014 $ \u2014 $ ( 34 ) $ \u2014 $ \u2014 $ 141 Derivatives designated as hedging instruments $ \u2014 $ \u2014 $ 55 $ \u2014 $ \u2014 $ ( 97 ) __________ (1) Gains on hedged items do not exactly offset losses on the related designated hedging instruments due to amortization of the cumulative amounts of fair value hedging adjustments included in the carrying amount of the hedged debt for discontinued\nw effects of our derivative contracts in the Condensed Consolidated Statements of Cash Flows are included in Net cash provided by operating activities, except for the settlement of notional amounts of cross-currency swaps, which are included in Net cash used in financing activities. In addition, our revolving credit agreement includes a financial covenant that requires us to maintain a specified minimum interest coverage ratio of (i) the sum of consolidated net income, interest expense, provision for income taxes, depreciation expense, amortization expense, unusual or nonrecurring charges and other noncash items (consolidated earnings before interest, taxes, depreciation and amortization) to (ii) consolidated interest expense, each as defined and described in the credit agreement. In addition, our revolving credit agreement includes a financial covenant that requires us to maintain a specified minimum interest coverage ratio of (i) the sum of consolidated net income, interest expense, provision for income taxes, depreciation expense, amortization expense, unusual or nonrecurring charges and other noncash items (consolidated earnings before interest, taxes, depreciation and amortization) to (ii) consolidated interest expense, each as defined and described in the credit agreement. Top negative sentences: (Regeneron) filed suit against Amgen in the Delaware District Court for federal and state antitrust and unfair competition violations and tortious interference with prospective business relations. Overview Amgen is a biotechnology company committed to unlocking the potential of biology for patients suffering from serious illnesses. Overview Amgen is a biotechnology company committed to unlocking the potential of biology for patients suffering from serious illnesses. Forward-looking snippets: The new standard provides temporary optional expedients and exceptions to current GAAP guidance on contract modifications and hedge accounting. Upon closing of the transaction, we expect to receive $ 135 million in cash. We are contesting the 2010\u20132012 and 2013\u20132015 Notices through the judicial process, and we will seek cons\nach resolution. We are contesting the 2010\u20132012 and 2013\u20132015 Notices through the judicial process, and we will seek consolidation of the two periods into one case in the U.S. We believe our accrual for income tax liabilities is appropriate based on past experience, interpretations of tax law, application of the tax law to our facts and judgments about potential actions by tax authorities; however, due to the complexity of the provision for income taxes and uncertain resolution of these matters, the ultimate outcome of any tax matters may result in payments substantially greater than amounts accrued and could have a material adverse impact on our condensed consolidated financial statements."
}